"No.","Time","Source","Destination","Protocol","Length","Info"
"1","0.000000","49.44.80.47","116.50.76.245","TCP","590","[TCP segment of a reassembled PDU]"
"2","0.000000","49.44.80.47","10.64.43.166","TCP","590","[TCP segment of a reassembled PDU]"
"3","0.000000","10.64.43.166","49.44.80.47","TCP","60","64435  >  443 [ACK] Seq=1 Ack=537 Win=65392 Len=0"
"4","0.000000","116.50.76.245","49.44.80.47","TCP","60","64435  >  443 [ACK] Seq=1 Ack=537 Win=65392 Len=0"
"5","0.004000","49.44.80.47","116.50.76.245","TCP","590","[TCP segment of a reassembled PDU]"
"6","0.004000","49.44.80.47","10.64.43.166","TCP","590","[TCP segment of a reassembled PDU]"
"7","0.004000","49.44.80.47","116.50.76.245","TCP","590","[TCP segment of a reassembled PDU]"
"8","0.004000","49.44.80.47","10.64.43.166","TCP","590","[TCP segment of a reassembled PDU]"
"9","0.004000","49.44.80.47","116.50.76.245","TCP","590","[TCP segment of a reassembled PDU]"
"10","0.004000","49.44.80.47","10.64.43.166","TCP","590","[TCP segment of a reassembled PDU]"
"11","0.004000","49.44.80.47","116.50.76.245","TCP","590","[TCP segment of a reassembled PDU]"
"12","0.004000","49.44.80.47","10.64.43.166","TCP","590","[TCP segment of a reassembled PDU]"
"13","0.004000","10.64.43.166","49.44.80.47","TCP","60","64435  >  443 [ACK] Seq=1 Ack=1073 Win=65392 Len=0"
"14","0.004000","116.50.76.245","49.44.80.47","TCP","60","64435  >  443 [ACK] Seq=1 Ack=1073 Win=65392 Len=0"
"15","0.004000","10.64.43.166","49.44.80.47","TCP","60","64435  >  443 [ACK] Seq=1 Ack=1609 Win=65392 Len=0"
"16","0.004000","116.50.76.245","49.44.80.47","TCP","60","64435  >  443 [ACK] Seq=1 Ack=1609 Win=65392 Len=0"
"17","0.004000","10.64.43.166","49.44.80.47","TCP","60","64435  >  443 [ACK] Seq=1 Ack=2145 Win=65392 Len=0"
"18","0.004000","116.50.76.245","49.44.80.47","TCP","60","64435  >  443 [ACK] Seq=1 Ack=2145 Win=65392 Len=0"
"19","0.004000","10.64.43.166","49.44.80.47","TCP","60","64435  >  443 [ACK] Seq=1 Ack=2681 Win=65392 Len=0"
"20","0.004000","116.50.76.245","49.44.80.47","TCP","60","64435  >  443 [ACK] Seq=1 Ack=2681 Win=65392 Len=0"
"21","0.004000","49.44.80.47","116.50.76.245","TCP","590","[TCP segment of a reassembled PDU]"
"22","0.004000","49.44.80.47","10.64.43.166","TCP","590","[TCP segment of a reassembled PDU]"
"23","0.004000","49.44.80.47","116.50.76.245","TCP","590","[TCP segment of a reassembled PDU]"
"24","0.004000","49.44.80.47","10.64.43.166","TCP","590","[TCP segment of a reassembled PDU]"
"25","0.004000","49.44.80.47","116.50.76.245","TCP","590","[TCP segment of a reassembled PDU]"
"26","0.004000","49.44.80.47","10.64.43.166","TCP","590","[TCP segment of a reassembled PDU]"
"27","0.004000","49.44.80.47","116.50.76.245","TCP","590","[TCP segment of a reassembled PDU]"
"28","0.004000","49.44.80.47","10.64.43.166","TCP","590","[TCP segment of a reassembled PDU]"
"29","0.004000","49.44.80.47","116.50.76.245","TCP","590","[TCP segment of a reassembled PDU]"
"30","0.004000","49.44.80.47","10.64.43.166","TCP","590","[TCP segment of a reassembled PDU]"
"31","0.004000","49.44.80.47","116.50.76.245","TCP","590","[TCP segment of a reassembled PDU]"
"32","0.004000","49.44.80.47","10.64.43.166","TCP","590","[TCP segment of a reassembled PDU]"
"33","0.004000","49.44.80.47","116.50.76.245","TCP","590","[TCP segment of a reassembled PDU]"
"34","0.004000","49.44.80.47","10.64.43.166","TCP","590","[TCP segment of a reassembled PDU]"
"35","0.004000","49.44.80.47","116.50.76.245","TCP","590","[TCP segment of a reassembled PDU]"
"36","0.004000","49.44.80.47","10.64.43.166","TCP","590","[TCP segment of a reassembled PDU]"
"37","0.008000","10.64.43.166","49.44.80.47","TCP","60","64435  >  443 [ACK] Seq=1 Ack=3217 Win=65392 Len=0"
"38","0.008000","116.50.76.245","49.44.80.47","TCP","60","64435  >  443 [ACK] Seq=1 Ack=3217 Win=65392 Len=0"
"39","0.008000","10.64.43.166","49.44.80.47","TCP","60","64435  >  443 [ACK] Seq=1 Ack=3753 Win=65392 Len=0"
"40","0.008000","116.50.76.245","49.44.80.47","TCP","60","64435  >  443 [ACK] Seq=1 Ack=3753 Win=65392 Len=0"
"41","0.008000","10.64.43.166","49.44.80.47","TCP","60","64435  >  443 [ACK] Seq=1 Ack=4825 Win=65392 Len=0"
"42","0.008000","116.50.76.245","49.44.80.47","TCP","60","64435  >  443 [ACK] Seq=1 Ack=4825 Win=65392 Len=0"
"43","0.008000","10.64.43.166","49.44.80.47","TCP","60","[TCP Dup ACK 41#1] 64435  >  443 [ACK] Seq=1 Ack=4825 Win=65392 Len=0"
"44","0.008000","116.50.76.245","49.44.80.47","TCP","60","[TCP Dup ACK 42#1] 64435  >  443 [ACK] Seq=1 Ack=4825 Win=65392 Len=0"
"45","0.008000","10.64.43.166","49.44.80.47","TCP","60","64435  >  443 [ACK] Seq=1 Ack=5361 Win=65392 Len=0"
"46","0.008000","116.50.76.245","49.44.80.47","TCP","60","64435  >  443 [ACK] Seq=1 Ack=5361 Win=65392 Len=0"
"47","0.008000","10.64.43.166","49.44.80.47","TCP","60","[TCP ACKed unseen segment] 64435  >  443 [ACK] Seq=1 Ack=8577 Win=65392 Len=0"
"48","0.008000","116.50.76.245","49.44.80.47","TCP","60","[TCP ACKed unseen segment] 64435  >  443 [ACK] Seq=1 Ack=8577 Win=65392 Len=0"
"49","0.008000","10.64.43.166","49.44.80.47","TCP","60","[TCP Dup ACK 47#1] [TCP ACKed unseen segment] 64435  >  443 [ACK] Seq=1 Ack=8577 Win=65392 Len=0"
"50","0.008000","116.50.76.245","49.44.80.47","TCP","60","[TCP Dup ACK 48#1] [TCP ACKed unseen segment] 64435  >  443 [ACK] Seq=1 Ack=8577 Win=65392 Len=0"
"51","0.008000","10.64.43.166","49.44.80.47","TCP","60","[TCP Dup ACK 47#2] [TCP ACKed unseen segment] 64435  >  443 [ACK] Seq=1 Ack=8577 Win=65392 Len=0"
"52","0.008000","116.50.76.245","49.44.80.47","TCP","60","[TCP Dup ACK 48#2] [TCP ACKed unseen segment] 64435  >  443 [ACK] Seq=1 Ack=8577 Win=65392 Len=0"
"53","0.008000","49.44.80.47","116.50.76.245","TCP","590","[TCP Spurious Retransmission]  [TCP segment of a reassembled PDU]"
"54","0.008000","49.44.80.47","10.64.43.166","TCP","590","[TCP Spurious Retransmission]  [TCP segment of a reassembled PDU]"
"55","0.008000","49.44.80.47","116.50.76.245","TCP","590","[TCP Spurious Retransmission]  [TCP segment of a reassembled PDU]"
"56","0.008000","49.44.80.47","10.64.43.166","TCP","590","[TCP Spurious Retransmission]  [TCP segment of a reassembled PDU]"
"57","0.008000","49.44.80.47","116.50.76.245","TCP","590","[TCP Spurious Retransmission]  [TCP segment of a reassembled PDU]"
"58","0.008000","49.44.80.47","10.64.43.166","TCP","590","[TCP Spurious Retransmission]  [TCP segment of a reassembled PDU]"
"59","0.008000","49.44.80.47","116.50.76.245","TCP","590","[TCP segment of a reassembled PDU]"
"60","0.008000","49.44.80.47","10.64.43.166","TCP","590","[TCP segment of a reassembled PDU]"
"61","0.008000","49.44.80.47","116.50.76.245","TCP","590","[TCP segment of a reassembled PDU]"
"62","0.008000","49.44.80.47","10.64.43.166","TCP","590","[TCP segment of a reassembled PDU]"
"63","0.008000","49.44.80.47","116.50.76.245","TCP","590","[TCP segment of a reassembled PDU]"
"64","0.008000","49.44.80.47","10.64.43.166","TCP","590","[TCP segment of a reassembled PDU]"
"65","0.008000","49.44.80.47","116.50.76.245","TCP","590","[TCP segment of a reassembled PDU]"
"66","0.008000","49.44.80.47","10.64.43.166","TCP","590","[TCP segment of a reassembled PDU]"
"67","0.008000","49.44.80.47","116.50.76.245","TCP","590","[TCP segment of a reassembled PDU]"
"68","0.008000","49.44.80.47","10.64.43.166","TCP","590","[TCP segment of a reassembled PDU]"
"69","0.008000","49.44.80.47","116.50.76.245","TCP","590","[TCP segment of a reassembled PDU]"
"70","0.008000","49.44.80.47","10.64.43.166","TCP","590","[TCP segment of a reassembled PDU]"
"71","0.008000","49.44.80.47","116.50.76.245","TCP","590","[TCP segment of a reassembled PDU]"
"72","0.008000","49.44.80.47","10.64.43.166","TCP","590","[TCP segment of a reassembled PDU]"
"73","0.008000","49.44.80.47","116.50.76.245","TCP","590","[TCP segment of a reassembled PDU]"
"74","0.008000","49.44.80.47","10.64.43.166","TCP","590","[TCP segment of a reassembled PDU]"
"75","0.008000","49.44.80.47","116.50.76.245","TCP","590","[TCP segment of a reassembled PDU]"
"76","0.008000","49.44.80.47","10.64.43.166","TCP","590","[TCP segment of a reassembled PDU]"
"77","0.008000","49.44.80.47","116.50.76.245","TCP","590","[TCP segment of a reassembled PDU]"
"78","0.008000","49.44.80.47","10.64.43.166","TCP","590","[TCP segment of a reassembled PDU]"
"79","0.008000","49.44.80.47","116.50.76.245","TCP","590","[TCP segment of a reassembled PDU]"
"80","0.008000","49.44.80.47","10.64.43.166","TCP","590","[TCP segment of a reassembled PDU]"
"81","0.008000","49.44.80.47","116.50.76.245","TCP","590","[TCP segment of a reassembled PDU]"
"82","0.008000","49.44.80.47","10.64.43.166","TCP","590","[TCP segment of a reassembled PDU]"
"83","0.008000","49.44.80.47","116.50.76.245","TCP","590","[TCP segment of a reassembled PDU]"
"84","0.008000","49.44.80.47","10.64.43.166","TCP","590","[TCP segment of a reassembled PDU]"
"85","0.008000","49.44.80.47","116.50.76.245","TCP","590","[TCP segment of a reassembled PDU]"
"86","0.008000","49.44.80.47","10.64.43.166","TCP","590","[TCP segment of a reassembled PDU]"
"87","0.008000","49.44.80.47","116.50.76.245","TCP","590","[TCP segment of a reassembled PDU]"
"88","0.008000","49.44.80.47","10.64.43.166","TCP","590","[TCP segment of a reassembled PDU]"
"89","0.008000","49.44.80.47","116.50.76.245","TCP","590","[TCP segment of a reassembled PDU]"
"90","0.008000","49.44.80.47","10.64.43.166","TCP","590","[TCP segment of a reassembled PDU]"
"91","0.008000","49.44.80.47","116.50.76.245","TCP","590","[TCP segment of a reassembled PDU]"
"92","0.008000","49.44.80.47","10.64.43.166","TCP","590","[TCP segment of a reassembled PDU]"
"93","0.008000","49.44.80.47","116.50.76.245","TCP","590","[TCP segment of a reassembled PDU]"
"94","0.008000","49.44.80.47","10.64.43.166","TCP","590","[TCP segment of a reassembled PDU]"
"95","0.008000","49.44.80.47","116.50.76.245","TCP","590","[TCP segment of a reassembled PDU]"
"96","0.008000","49.44.80.47","10.64.43.166","TCP","590","[TCP segment of a reassembled PDU]"
"97","0.012000","10.64.43.166","49.44.80.47","TCP","60","[TCP Dup ACK 47#3] 64435  >  443 [ACK] Seq=1 Ack=8577 Win=65392 Len=0"
"98","0.012000","116.50.76.245","49.44.80.47","TCP","60","[TCP Dup ACK 48#3] 64435  >  443 [ACK] Seq=1 Ack=8577 Win=65392 Len=0"
"99","0.012000","10.64.43.166","49.44.80.47","TCP","60","[TCP Dup ACK 47#4] 64435  >  443 [ACK] Seq=1 Ack=8577 Win=65392 Len=0"
"100","0.012000","116.50.76.245","49.44.80.47","TCP","60","[TCP Dup ACK 48#4] 64435  >  443 [ACK] Seq=1 Ack=8577 Win=65392 Len=0"
"101","0.012000","10.64.43.166","49.44.80.47","TCP","60","[TCP Dup ACK 47#5] 64435  >  443 [ACK] Seq=1 Ack=8577 Win=65392 Len=0"
"102","0.012000","116.50.76.245","49.44.80.47","TCP","60","[TCP Dup ACK 48#5] 64435  >  443 [ACK] Seq=1 Ack=8577 Win=65392 Len=0"
"103","0.012000","10.64.43.166","49.44.80.47","TCP","60","64435  >  443 [ACK] Seq=1 Ack=9649 Win=65392 Len=0"
"104","0.012000","116.50.76.245","49.44.80.47","TCP","60","64435  >  443 [ACK] Seq=1 Ack=9649 Win=65392 Len=0"
"105","0.012000","10.64.43.166","49.44.80.47","TCP","60","[TCP Dup ACK 103#1] 64435  >  443 [ACK] Seq=1 Ack=9649 Win=65392 Len=0"
"106","0.012000","116.50.76.245","49.44.80.47","TCP","60","[TCP Dup ACK 104#1] 64435  >  443 [ACK] Seq=1 Ack=9649 Win=65392 Len=0"
"107","0.012000","10.64.43.166","49.44.80.47","TCP","60","64435  >  443 [ACK] Seq=1 Ack=10185 Win=65392 Len=0"
"108","0.012000","116.50.76.245","49.44.80.47","TCP","60","64435  >  443 [ACK] Seq=1 Ack=10185 Win=65392 Len=0"
"109","0.012000","10.64.43.166","49.44.80.47","TCP","60","64435  >  443 [ACK] Seq=1 Ack=10721 Win=65392 Len=0"
"110","0.012000","116.50.76.245","49.44.80.47","TCP","60","64435  >  443 [ACK] Seq=1 Ack=10721 Win=65392 Len=0"
"111","0.012000","10.64.43.166","49.44.80.47","TCP","60","64435  >  443 [ACK] Seq=1 Ack=11257 Win=65392 Len=0"
"112","0.012000","116.50.76.245","49.44.80.47","TCP","60","64435  >  443 [ACK] Seq=1 Ack=11257 Win=65392 Len=0"
"113","0.012000","10.64.43.166","49.44.80.47","TCP","60","64435  >  443 [ACK] Seq=1 Ack=11793 Win=65392 Len=0"
"114","0.012000","116.50.76.245","49.44.80.47","TCP","60","64435  >  443 [ACK] Seq=1 Ack=11793 Win=65392 Len=0"
"115","0.012000","10.64.43.166","49.44.80.47","TCP","60","64435  >  443 [ACK] Seq=1 Ack=12329 Win=65392 Len=0"
"116","0.012000","116.50.76.245","49.44.80.47","TCP","60","64435  >  443 [ACK] Seq=1 Ack=12329 Win=65392 Len=0"
"117","0.012000","10.64.43.166","49.44.80.47","TCP","60","64435  >  443 [ACK] Seq=1 Ack=12865 Win=65392 Len=0"
"118","0.012000","116.50.76.245","49.44.80.47","TCP","60","64435  >  443 [ACK] Seq=1 Ack=12865 Win=65392 Len=0"
"119","0.012000","10.64.43.166","49.44.80.47","TCP","60","64435  >  443 [ACK] Seq=1 Ack=13401 Win=65392 Len=0"
"120","0.012000","116.50.76.245","49.44.80.47","TCP","60","64435  >  443 [ACK] Seq=1 Ack=13401 Win=65392 Len=0"
"121","0.012000","10.64.43.166","49.44.80.47","TCP","60","64435  >  443 [ACK] Seq=1 Ack=13937 Win=65392 Len=0"
"122","0.012000","116.50.76.245","49.44.80.47","TCP","60","64435  >  443 [ACK] Seq=1 Ack=13937 Win=65392 Len=0"
"123","0.012000","10.64.43.166","49.44.80.47","TCP","60","64435  >  443 [ACK] Seq=1 Ack=15009 Win=65392 Len=0"
"124","0.012000","116.50.76.245","49.44.80.47","TCP","60","64435  >  443 [ACK] Seq=1 Ack=15009 Win=65392 Len=0"
"125","0.012000","10.64.43.166","49.44.80.47","TCP","60","[TCP Dup ACK 123#1] 64435  >  443 [ACK] Seq=1 Ack=15009 Win=65392 Len=0"
"126","0.012000","116.50.76.245","49.44.80.47","TCP","60","[TCP Dup ACK 124#1] 64435  >  443 [ACK] Seq=1 Ack=15009 Win=65392 Len=0"
"127","0.012000","10.64.43.166","49.44.80.47","TCP","60","64435  >  443 [ACK] Seq=1 Ack=15545 Win=65392 Len=0"
"128","0.012000","116.50.76.245","49.44.80.47","TCP","60","64435  >  443 [ACK] Seq=1 Ack=15545 Win=65392 Len=0"
"129","0.012000","10.64.43.166","49.44.80.47","TCP","60","64435  >  443 [ACK] Seq=1 Ack=16081 Win=65392 Len=0"
"130","0.012000","116.50.76.245","49.44.80.47","TCP","60","64435  >  443 [ACK] Seq=1 Ack=16081 Win=65392 Len=0"
"131","0.012000","10.64.43.166","49.44.80.47","TCP","60","64435  >  443 [ACK] Seq=1 Ack=16617 Win=65392 Len=0"
"132","0.012000","116.50.76.245","49.44.80.47","TCP","60","64435  >  443 [ACK] Seq=1 Ack=16617 Win=65392 Len=0"
"133","0.012000","10.64.43.166","49.44.80.47","TCP","60","64435  >  443 [ACK] Seq=1 Ack=17153 Win=65392 Len=0"
"134","0.012000","116.50.76.245","49.44.80.47","TCP","60","64435  >  443 [ACK] Seq=1 Ack=17153 Win=65392 Len=0"
"135","0.012000","10.64.43.166","49.44.80.47","TCP","60","64435  >  443 [ACK] Seq=1 Ack=17689 Win=64856 Len=0"
"136","0.012000","116.50.76.245","49.44.80.47","TCP","60","64435  >  443 [ACK] Seq=1 Ack=17689 Win=64856 Len=0"
"137","0.012000","49.44.80.47","116.50.76.245","TCP","590","[TCP segment of a reassembled PDU]"
"138","0.012000","49.44.80.47","10.64.43.166","TCP","590","[TCP segment of a reassembled PDU]"
"139","0.012000","49.44.80.47","116.50.76.245","SSLv2","590","Encrypted Data"
"140","0.012000","49.44.80.47","10.64.43.166","SSLv2","590","Encrypted Data"
"141","0.012000","49.44.80.47","116.50.76.245","TCP","590","[TCP segment of a reassembled PDU]"
"142","0.012000","49.44.80.47","10.64.43.166","TCP","590","[TCP segment of a reassembled PDU]"
"143","0.012000","49.44.80.47","116.50.76.245","TCP","590","[TCP segment of a reassembled PDU]"
"144","0.012000","49.44.80.47","10.64.43.166","TCP","590","[TCP segment of a reassembled PDU]"
"145","0.012000","49.44.80.47","116.50.76.245","TCP","590","[TCP segment of a reassembled PDU]"
"146","0.012000","49.44.80.47","10.64.43.166","TCP","590","[TCP segment of a reassembled PDU]"
"147","0.012000","49.44.80.47","116.50.76.245","TCP","590","[TCP segment of a reassembled PDU]"
"148","0.012000","49.44.80.47","10.64.43.166","TCP","590","[TCP segment of a reassembled PDU]"
"149","0.012000","49.44.80.47","116.50.76.245","TCP","590","[TCP segment of a reassembled PDU]"
"150","0.012000","49.44.80.47","10.64.43.166","TCP","590","[TCP segment of a reassembled PDU]"
"151","0.012000","49.44.80.47","116.50.76.245","TCP","590","[TCP segment of a reassembled PDU]"
"152","0.012000","49.44.80.47","10.64.43.166","TCP","590","[TCP segment of a reassembled PDU]"
"153","0.012000","49.44.80.47","116.50.76.245","TCP","590","[TCP segment of a reassembled PDU]"
"154","0.012000","49.44.80.47","10.64.43.166","TCP","590","[TCP segment of a reassembled PDU]"
"155","0.012000","49.44.80.47","116.50.76.245","TCP","590","[TCP segment of a reassembled PDU]"
"156","0.012000","49.44.80.47","10.64.43.166","TCP","590","[TCP segment of a reassembled PDU]"
"157","0.012000","49.44.80.47","116.50.76.245","TCP","590","[TCP segment of a reassembled PDU]"
"158","0.012000","49.44.80.47","10.64.43.166","TCP","590","[TCP segment of a reassembled PDU]"
"159","0.012000","49.44.80.47","116.50.76.245","TCP","590","[TCP segment of a reassembled PDU]"
"160","0.012000","49.44.80.47","10.64.43.166","TCP","590","[TCP segment of a reassembled PDU]"
"161","0.012000","49.44.80.47","116.50.76.245","TCP","590","[TCP segment of a reassembled PDU]"
"162","0.012000","49.44.80.47","10.64.43.166","TCP","590","[TCP segment of a reassembled PDU]"
"163","0.012000","49.44.80.47","116.50.76.245","TCP","590","[TCP segment of a reassembled PDU]"
"164","0.012000","49.44.80.47","10.64.43.166","TCP","590","[TCP segment of a reassembled PDU]"
"165","0.012000","10.64.43.166","49.44.80.47","TCP","60","64435  >  443 [ACK] Seq=1 Ack=18225 Win=64320 Len=0"
"166","0.012000","116.50.76.245","49.44.80.47","TCP","60","64435  >  443 [ACK] Seq=1 Ack=18225 Win=64320 Len=0"
"167","0.012000","49.44.80.47","116.50.76.245","TCP","590","[TCP segment of a reassembled PDU]"
"168","0.012000","49.44.80.47","10.64.43.166","TCP","590","[TCP segment of a reassembled PDU]"
"169","0.012000","10.64.43.166","49.44.80.47","TCP","60","64435  >  443 [ACK] Seq=1 Ack=18761 Win=63784 Len=0"
"170","0.012000","116.50.76.245","49.44.80.47","TCP","60","64435  >  443 [ACK] Seq=1 Ack=18761 Win=63784 Len=0"
"171","0.012000","49.44.80.47","116.50.76.245","TCP","590","[TCP segment of a reassembled PDU]"
"172","0.012000","49.44.80.47","10.64.43.166","TCP","590","[TCP segment of a reassembled PDU]"
"173","0.012000","49.44.80.47","116.50.76.245","TCP","590","[TCP segment of a reassembled PDU]"
"174","0.012000","49.44.80.47","10.64.43.166","TCP","590","[TCP segment of a reassembled PDU]"
"175","0.012000","49.44.80.47","116.50.76.245","TCP","590","[TCP segment of a reassembled PDU]"
"176","0.012000","49.44.80.47","10.64.43.166","TCP","590","[TCP segment of a reassembled PDU]"
"177","0.012000","49.44.80.47","116.50.76.245","TCP","590","[TCP segment of a reassembled PDU]"
"178","0.012000","49.44.80.47","10.64.43.166","TCP","590","[TCP segment of a reassembled PDU]"
"179","0.012000","49.44.80.47","116.50.76.245","TCP","590","[TCP segment of a reassembled PDU]"
"180","0.012000","49.44.80.47","10.64.43.166","TCP","590","[TCP segment of a reassembled PDU]"
"181","0.012000","49.44.80.47","116.50.76.245","TCP","590","[TCP segment of a reassembled PDU]"
"182","0.012000","49.44.80.47","10.64.43.166","TCP","590","[TCP segment of a reassembled PDU]"
"183","0.012000","49.44.80.47","116.50.76.245","TCP","590","[TCP segment of a reassembled PDU]"
"184","0.012000","49.44.80.47","10.64.43.166","TCP","590","[TCP segment of a reassembled PDU]"
"185","0.012000","49.44.80.47","116.50.76.245","TCP","590","[TCP segment of a reassembled PDU]"
"186","0.012000","49.44.80.47","10.64.43.166","TCP","590","[TCP segment of a reassembled PDU]"
"187","0.012000","49.44.80.47","116.50.76.245","TCP","590","[TCP segment of a reassembled PDU]"
"188","0.012000","49.44.80.47","10.64.43.166","TCP","590","[TCP segment of a reassembled PDU]"
"189","0.012000","49.44.80.47","116.50.76.245","TCP","590","[TCP segment of a reassembled PDU]"
"190","0.012000","49.44.80.47","10.64.43.166","TCP","590","[TCP segment of a reassembled PDU]"
"191","0.012000","49.44.80.47","116.50.76.245","TCP","590","[TCP segment of a reassembled PDU]"
"192","0.012000","49.44.80.47","10.64.43.166","TCP","590","[TCP segment of a reassembled PDU]"
"193","0.012000","49.44.80.47","116.50.76.245","TCP","590","[TCP segment of a reassembled PDU]"
"194","0.012000","49.44.80.47","10.64.43.166","TCP","590","[TCP segment of a reassembled PDU]"
"195","0.012000","49.44.80.47","116.50.76.245","TCP","590","[TCP segment of a reassembled PDU]"
"196","0.012000","49.44.80.47","10.64.43.166","TCP","590","[TCP segment of a reassembled PDU]"
"197","0.012000","49.44.80.47","116.50.76.245","TCP","590","[TCP segment of a reassembled PDU]"
"198","0.012000","49.44.80.47","10.64.43.166","TCP","590","[TCP segment of a reassembled PDU]"
"199","0.012000","49.44.80.47","116.50.76.245","TCP","590","[TCP segment of a reassembled PDU]"
"200","0.012000","49.44.80.47","10.64.43.166","TCP","590","[TCP segment of a reassembled PDU]"
"201","0.012000","49.44.80.47","116.50.76.245","TCP","590","[TCP segment of a reassembled PDU]"
"202","0.012000","49.44.80.47","10.64.43.166","TCP","590","[TCP segment of a reassembled PDU]"
"203","0.012000","49.44.80.47","116.50.76.245","TCP","590","[TCP segment of a reassembled PDU]"
"204","0.012000","49.44.80.47","10.64.43.166","TCP","590","[TCP segment of a reassembled PDU]"
"205","0.012000","49.44.80.47","116.50.76.245","TCP","590","443  >  64435 [ACK] Seq=35913 Ack=1 Win=49312 Len=536 [TCP segment of a reassembled PDU]"
"206","0.012000","49.44.80.47","10.64.43.166","TCP","590","443  >  64435 [ACK] Seq=35913 Ack=1 Win=49312 Len=536 [TCP segment of a reassembled PDU]"
"207","0.012000","49.44.80.47","116.50.76.245","TCP","590","443  >  64435 [ACK] Seq=36449 Ack=1 Win=49312 Len=536 [TCP segment of a reassembled PDU]"
"208","0.012000","49.44.80.47","10.64.43.166","TCP","590","443  >  64435 [ACK] Seq=36449 Ack=1 Win=49312 Len=536 [TCP segment of a reassembled PDU]"
"209","0.012000","49.44.80.47","116.50.76.245","TCP","590","443  >  64435 [ACK] Seq=36985 Ack=1 Win=49312 Len=536 [TCP segment of a reassembled PDU]"
"210","0.012000","49.44.80.47","10.64.43.166","TCP","590","443  >  64435 [ACK] Seq=36985 Ack=1 Win=49312 Len=536 [TCP segment of a reassembled PDU]"
"211","0.012000","49.44.80.47","116.50.76.245","TCP","590","443  >  64435 [ACK] Seq=37521 Ack=1 Win=49312 Len=536 [TCP segment of a reassembled PDU]"
"212","0.012000","49.44.80.47","10.64.43.166","TCP","590","443  >  64435 [ACK] Seq=37521 Ack=1 Win=49312 Len=536 [TCP segment of a reassembled PDU]"
"213","0.012000","49.44.80.47","116.50.76.245","TCP","590","443  >  64435 [ACK] Seq=38057 Ack=1 Win=49312 Len=536 [TCP segment of a reassembled PDU]"
"214","0.012000","49.44.80.47","10.64.43.166","TCP","590","443  >  64435 [ACK] Seq=38057 Ack=1 Win=49312 Len=536 [TCP segment of a reassembled PDU]"
"215","0.012000","49.44.80.47","116.50.76.245","TCP","590","443  >  64435 [ACK] Seq=38593 Ack=1 Win=49312 Len=536 [TCP segment of a reassembled PDU]"
"216","0.012000","49.44.80.47","10.64.43.166","TCP","590","443  >  64435 [ACK] Seq=38593 Ack=1 Win=49312 Len=536 [TCP segment of a reassembled PDU]"
"217","0.012000","10.64.43.166","49.44.80.47","TCP","60","64435  >  443 [ACK] Seq=1 Ack=21977 Win=60568 Len=0"
"218","0.012000","116.50.76.245","49.44.80.47","TCP","60","64435  >  443 [ACK] Seq=1 Ack=21977 Win=60568 Len=0"
"219","0.012000","10.64.43.166","49.44.80.47","TCP","60","[TCP Dup ACK 217#1] 64435  >  443 [ACK] Seq=1 Ack=21977 Win=60568 Len=0"
"220","0.012000","116.50.76.245","49.44.80.47","TCP","60","[TCP Dup ACK 218#1] 64435  >  443 [ACK] Seq=1 Ack=21977 Win=60568 Len=0"
"221","0.012000","10.64.43.166","49.44.80.47","TCP","60","[TCP Dup ACK 217#2] 64435  >  443 [ACK] Seq=1 Ack=21977 Win=60568 Len=0"
"222","0.012000","116.50.76.245","49.44.80.47","TCP","60","[TCP Dup ACK 218#2] 64435  >  443 [ACK] Seq=1 Ack=21977 Win=60568 Len=0"
"223","0.012000","10.64.43.166","49.44.80.47","TCP","60","[TCP Dup ACK 217#3] 64435  >  443 [ACK] Seq=1 Ack=21977 Win=60568 Len=0"
"224","0.012000","116.50.76.245","49.44.80.47","TCP","60","[TCP Dup ACK 218#3] 64435  >  443 [ACK] Seq=1 Ack=21977 Win=60568 Len=0"
"225","0.012000","10.64.43.166","49.44.80.47","TCP","60","[TCP Dup ACK 217#4] 64435  >  443 [ACK] Seq=1 Ack=21977 Win=60568 Len=0"
"226","0.012000","116.50.76.245","49.44.80.47","TCP","60","[TCP Dup ACK 218#4] 64435  >  443 [ACK] Seq=1 Ack=21977 Win=60568 Len=0"
"227","0.012000","10.64.43.166","49.44.80.47","TCP","60","[TCP Dup ACK 217#5] 64435  >  443 [ACK] Seq=1 Ack=21977 Win=60568 Len=0"
"228","0.012000","116.50.76.245","49.44.80.47","TCP","60","[TCP Dup ACK 218#5] 64435  >  443 [ACK] Seq=1 Ack=21977 Win=60568 Len=0"
"229","0.012000","10.64.43.166","49.44.80.47","TCP","60","64435  >  443 [ACK] Seq=1 Ack=22513 Win=60032 Len=0"
"230","0.012000","116.50.76.245","49.44.80.47","TCP","60","64435  >  443 [ACK] Seq=1 Ack=22513 Win=60032 Len=0"
"231","0.012000","10.64.43.166","49.44.80.47","TCP","60","64435  >  443 [ACK] Seq=1 Ack=23049 Win=59496 Len=0"
"232","0.012000","116.50.76.245","49.44.80.47","TCP","60","64435  >  443 [ACK] Seq=1 Ack=23049 Win=59496 Len=0"
"233","0.012000","10.64.43.166","49.44.80.47","TCP","60","64435  >  443 [ACK] Seq=1 Ack=23585 Win=58960 Len=0"
"234","0.012000","116.50.76.245","49.44.80.47","TCP","60","64435  >  443 [ACK] Seq=1 Ack=23585 Win=58960 Len=0"
"235","0.012000","10.64.43.166","49.44.80.47","TCP","60","64435  >  443 [ACK] Seq=1 Ack=24121 Win=58424 Len=0"
"236","0.012000","116.50.76.245","49.44.80.47","TCP","60","64435  >  443 [ACK] Seq=1 Ack=24121 Win=58424 Len=0"
"237","0.012000","10.64.43.166","49.44.80.47","TCP","60","64435  >  443 [ACK] Seq=1 Ack=24657 Win=57888 Len=0"
"238","0.012000","116.50.76.245","49.44.80.47","TCP","60","64435  >  443 [ACK] Seq=1 Ack=24657 Win=57888 Len=0"
"239","0.012000","10.64.43.166","49.44.80.47","TCP","60","64435  >  443 [ACK] Seq=1 Ack=27337 Win=55208 Len=0"
"240","0.012000","116.50.76.245","49.44.80.47","TCP","60","64435  >  443 [ACK] Seq=1 Ack=27337 Win=55208 Len=0"
"241","0.012000","10.64.43.166","49.44.80.47","TCP","60","[TCP Dup ACK 239#1] 64435  >  443 [ACK] Seq=1 Ack=27337 Win=55208 Len=0"
"242","0.012000","116.50.76.245","49.44.80.47","TCP","60","[TCP Dup ACK 240#1] 64435  >  443 [ACK] Seq=1 Ack=27337 Win=55208 Len=0"
"243","0.012000","10.64.43.166","49.44.80.47","TCP","60","[TCP Dup ACK 239#2] 64435  >  443 [ACK] Seq=1 Ack=27337 Win=55208 Len=0"
"244","0.012000","116.50.76.245","49.44.80.47","TCP","60","[TCP Dup ACK 240#2] 64435  >  443 [ACK] Seq=1 Ack=27337 Win=55208 Len=0"
"245","0.012000","10.64.43.166","49.44.80.47","TCP","60","[TCP Dup ACK 239#3] 64435  >  443 [ACK] Seq=1 Ack=27337 Win=55208 Len=0"
"246","0.012000","116.50.76.245","49.44.80.47","TCP","60","[TCP Dup ACK 240#3] 64435  >  443 [ACK] Seq=1 Ack=27337 Win=55208 Len=0"
"247","0.012000","10.64.43.166","49.44.80.47","TCP","60","[TCP Dup ACK 239#4] 64435  >  443 [ACK] Seq=1 Ack=27337 Win=55208 Len=0"
"248","0.012000","116.50.76.245","49.44.80.47","TCP","60","[TCP Dup ACK 240#4] 64435  >  443 [ACK] Seq=1 Ack=27337 Win=55208 Len=0"
"249","0.012000","10.64.43.166","49.44.80.47","TCP","60","64435  >  443 [ACK] Seq=1 Ack=27873 Win=54672 Len=0"
"250","0.012000","116.50.76.245","49.44.80.47","TCP","60","64435  >  443 [ACK] Seq=1 Ack=27873 Win=54672 Len=0"
"251","0.012000","10.64.43.166","49.44.80.47","TCP","60","64435  >  443 [ACK] Seq=1 Ack=28409 Win=54136 Len=0"
"252","0.012000","116.50.76.245","49.44.80.47","TCP","60","64435  >  443 [ACK] Seq=1 Ack=28409 Win=54136 Len=0"
"253","0.012000","10.64.43.166","49.44.80.47","TCP","60","64435  >  443 [ACK] Seq=1 Ack=28945 Win=53600 Len=0"
"254","0.012000","116.50.76.245","49.44.80.47","TCP","60","64435  >  443 [ACK] Seq=1 Ack=28945 Win=53600 Len=0"
"255","0.012000","10.64.43.166","49.44.80.47","TCP","60","64435  >  443 [ACK] Seq=1 Ack=29481 Win=53064 Len=0"
"256","0.012000","116.50.76.245","49.44.80.47","TCP","60","64435  >  443 [ACK] Seq=1 Ack=29481 Win=53064 Len=0"
"257","0.012000","10.64.43.166","49.44.80.47","TCP","60","64435  >  443 [ACK] Seq=1 Ack=30017 Win=52528 Len=0"
"258","0.012000","116.50.76.245","49.44.80.47","TCP","60","64435  >  443 [ACK] Seq=1 Ack=30017 Win=52528 Len=0"
"259","0.012000","10.64.43.166","49.44.80.47","TCP","60","64435  >  443 [ACK] Seq=1 Ack=30553 Win=51992 Len=0"
"260","0.012000","116.50.76.245","49.44.80.47","TCP","60","64435  >  443 [ACK] Seq=1 Ack=30553 Win=51992 Len=0"
"261","0.012000","10.64.43.166","49.44.80.47","TCP","60","64435  >  443 [ACK] Seq=1 Ack=31625 Win=50920 Len=0"
"262","0.012000","116.50.76.245","49.44.80.47","TCP","60","64435  >  443 [ACK] Seq=1 Ack=31625 Win=50920 Len=0"
"263","0.012000","10.64.43.166","49.44.80.47","TCP","60","[TCP Dup ACK 261#1] 64435  >  443 [ACK] Seq=1 Ack=31625 Win=50920 Len=0"
"264","0.012000","116.50.76.245","49.44.80.47","TCP","60","[TCP Dup ACK 262#1] 64435  >  443 [ACK] Seq=1 Ack=31625 Win=50920 Len=0"
"265","0.012000","10.64.43.166","49.44.80.47","TCP","60","64435  >  443 [ACK] Seq=1 Ack=32161 Win=50384 Len=0"
"266","0.012000","116.50.76.245","49.44.80.47","TCP","60","64435  >  443 [ACK] Seq=1 Ack=32161 Win=50384 Len=0"
"267","0.012000","10.64.43.166","49.44.80.47","TCP","60","64435  >  443 [ACK] Seq=1 Ack=32697 Win=49848 Len=0"
"268","0.012000","116.50.76.245","49.44.80.47","TCP","60","64435  >  443 [ACK] Seq=1 Ack=32697 Win=49848 Len=0"
"269","0.012000","10.64.43.166","49.44.80.47","TCP","60","64435  >  443 [ACK] Seq=1 Ack=33233 Win=49312 Len=0"
"270","0.012000","116.50.76.245","49.44.80.47","TCP","60","64435  >  443 [ACK] Seq=1 Ack=33233 Win=49312 Len=0"
"271","0.012000","10.64.43.166","49.44.80.47","TCP","60","64435  >  443 [ACK] Seq=1 Ack=33769 Win=48776 Len=0"
"272","0.012000","116.50.76.245","49.44.80.47","TCP","60","64435  >  443 [ACK] Seq=1 Ack=33769 Win=48776 Len=0"
"273","0.012000","10.64.43.166","49.44.80.47","TCP","60","64435  >  443 [ACK] Seq=1 Ack=34305 Win=48240 Len=0"
"274","0.012000","116.50.76.245","49.44.80.47","TCP","60","64435  >  443 [ACK] Seq=1 Ack=34305 Win=48240 Len=0"
"275","0.012000","10.64.43.166","49.44.80.47","TCP","60","64435  >  443 [ACK] Seq=1 Ack=34841 Win=47704 Len=0"
"276","0.012000","116.50.76.245","49.44.80.47","TCP","60","64435  >  443 [ACK] Seq=1 Ack=34841 Win=47704 Len=0"
"277","0.012000","10.64.43.166","49.44.80.47","TCP","60","64435  >  443 [ACK] Seq=1 Ack=35377 Win=47168 Len=0"
"278","0.012000","116.50.76.245","49.44.80.47","TCP","60","64435  >  443 [ACK] Seq=1 Ack=35377 Win=47168 Len=0"
"279","0.012000","10.64.43.166","49.44.80.47","TCP","60","64435  >  443 [ACK] Seq=1 Ack=36449 Win=46096 Len=0"
"280","0.012000","116.50.76.245","49.44.80.47","TCP","60","64435  >  443 [ACK] Seq=1 Ack=36449 Win=46096 Len=0"
"281","0.012000","10.64.43.166","49.44.80.47","TCP","60","[TCP Dup ACK 279#1] 64435  >  443 [ACK] Seq=1 Ack=36449 Win=46096 Len=0"
"282","0.012000","116.50.76.245","49.44.80.47","TCP","60","[TCP Dup ACK 280#1] 64435  >  443 [ACK] Seq=1 Ack=36449 Win=46096 Len=0"
"283","0.012000","10.64.43.166","49.44.80.47","TCP","60","64435  >  443 [ACK] Seq=1 Ack=37521 Win=45024 Len=0"
"284","0.012000","116.50.76.245","49.44.80.47","TCP","60","64435  >  443 [ACK] Seq=1 Ack=37521 Win=45024 Len=0"
"285","0.012000","49.44.80.47","116.50.76.245","TCP","590","443  >  64435 [ACK] Seq=39129 Ack=1 Win=49312 Len=536 [TCP segment of a reassembled PDU]"
"286","0.012000","49.44.80.47","10.64.43.166","TCP","590","443  >  64435 [ACK] Seq=39129 Ack=1 Win=49312 Len=536 [TCP segment of a reassembled PDU]"
"287","0.012000","49.44.80.47","116.50.76.245","TCP","590","443  >  64435 [ACK] Seq=39665 Ack=1 Win=49312 Len=536 [TCP segment of a reassembled PDU]"
"288","0.012000","49.44.80.47","10.64.43.166","TCP","590","443  >  64435 [ACK] Seq=39665 Ack=1 Win=49312 Len=536 [TCP segment of a reassembled PDU]"
"289","0.012000","49.44.80.47","116.50.76.245","TCP","590","443  >  64435 [ACK] Seq=40201 Ack=1 Win=49312 Len=536 [TCP segment of a reassembled PDU]"
"290","0.012000","49.44.80.47","10.64.43.166","TCP","590","443  >  64435 [ACK] Seq=40201 Ack=1 Win=49312 Len=536 [TCP segment of a reassembled PDU]"
"291","0.012000","49.44.80.47","116.50.76.245","TCP","590","443  >  64435 [ACK] Seq=40737 Ack=1 Win=49312 Len=536 [TCP segment of a reassembled PDU]"
"292","0.012000","49.44.80.47","10.64.43.166","TCP","590","443  >  64435 [ACK] Seq=40737 Ack=1 Win=49312 Len=536 [TCP segment of a reassembled PDU]"
"293","0.012000","49.44.80.47","116.50.76.245","TCP","590","443  >  64435 [ACK] Seq=41273 Ack=1 Win=49312 Len=536 [TCP segment of a reassembled PDU]"
"294","0.012000","49.44.80.47","10.64.43.166","TCP","590","443  >  64435 [ACK] Seq=41273 Ack=1 Win=49312 Len=536 [TCP segment of a reassembled PDU]"
"295","0.012000","49.44.80.47","116.50.76.245","TCP","590","443  >  64435 [ACK] Seq=41809 Ack=1 Win=49312 Len=536 [TCP segment of a reassembled PDU]"
"296","0.012000","49.44.80.47","10.64.43.166","TCP","590","443  >  64435 [ACK] Seq=41809 Ack=1 Win=49312 Len=536 [TCP segment of a reassembled PDU]"
"297","0.012000","49.44.80.47","116.50.76.245","TCP","590","443  >  64435 [ACK] Seq=42345 Ack=1 Win=49312 Len=536 [TCP segment of a reassembled PDU]"
"298","0.012000","49.44.80.47","10.64.43.166","TCP","590","443  >  64435 [ACK] Seq=42345 Ack=1 Win=49312 Len=536 [TCP segment of a reassembled PDU]"
"299","0.012000","49.44.80.47","116.50.76.245","TCP","590","443  >  64435 [ACK] Seq=42881 Ack=1 Win=49312 Len=536 [TCP segment of a reassembled PDU]"
"300","0.012000","49.44.80.47","10.64.43.166","TCP","590","443  >  64435 [ACK] Seq=42881 Ack=1 Win=49312 Len=536 [TCP segment of a reassembled PDU]"
"301","0.012000","49.44.80.47","116.50.76.245","TCP","590","443  >  64435 [ACK] Seq=43417 Ack=1 Win=49312 Len=536 [TCP segment of a reassembled PDU]"
"302","0.012000","49.44.80.47","10.64.43.166","TCP","590","443  >  64435 [ACK] Seq=43417 Ack=1 Win=49312 Len=536 [TCP segment of a reassembled PDU]"
"303","0.012000","49.44.80.47","116.50.76.245","TCP","590","443  >  64435 [ACK] Seq=43953 Ack=1 Win=49312 Len=536 [TCP segment of a reassembled PDU]"
"304","0.012000","49.44.80.47","10.64.43.166","TCP","590","443  >  64435 [ACK] Seq=43953 Ack=1 Win=49312 Len=536 [TCP segment of a reassembled PDU]"
"305","0.012000","49.44.80.47","116.50.76.245","TCP","590","443  >  64435 [ACK] Seq=44489 Ack=1 Win=49312 Len=536 [TCP segment of a reassembled PDU]"
"306","0.012000","49.44.80.47","10.64.43.166","TCP","590","443  >  64435 [ACK] Seq=44489 Ack=1 Win=49312 Len=536 [TCP segment of a reassembled PDU]"
"307","0.012000","49.44.80.47","116.50.76.245","TCP","590","443  >  64435 [ACK] Seq=45025 Ack=1 Win=49312 Len=536 [TCP segment of a reassembled PDU]"
"308","0.012000","49.44.80.47","10.64.43.166","TCP","590","443  >  64435 [ACK] Seq=45025 Ack=1 Win=49312 Len=536 [TCP segment of a reassembled PDU]"
"309","0.012000","10.64.43.166","49.44.80.47","TCP","60","[TCP Dup ACK 283#1] 64435  >  443 [ACK] Seq=1 Ack=37521 Win=45024 Len=0"
"310","0.012000","116.50.76.245","49.44.80.47","TCP","60","[TCP Dup ACK 284#1] 64435  >  443 [ACK] Seq=1 Ack=37521 Win=45024 Len=0"
"311","0.012000","49.44.80.47","116.50.76.245","TCP","590","443  >  64435 [ACK] Seq=45561 Ack=1 Win=49312 Len=536 [TCP segment of a reassembled PDU]"
"312","0.012000","49.44.80.47","10.64.43.166","TCP","590","443  >  64435 [ACK] Seq=45561 Ack=1 Win=49312 Len=536 [TCP segment of a reassembled PDU]"
"313","0.012000","10.64.43.166","49.44.80.47","TCP","60","64435  >  443 [ACK] Seq=1 Ack=38057 Win=44488 Len=0"
"314","0.012000","116.50.76.245","49.44.80.47","TCP","60","64435  >  443 [ACK] Seq=1 Ack=38057 Win=44488 Len=0"
"315","0.012000","49.44.80.47","116.50.76.245","TCP","590","443  >  64435 [ACK] Seq=46097 Ack=1 Win=49312 Len=536 [TCP segment of a reassembled PDU]"
"316","0.012000","49.44.80.47","10.64.43.166","TCP","590","443  >  64435 [ACK] Seq=46097 Ack=1 Win=49312 Len=536 [TCP segment of a reassembled PDU]"
"317","0.012000","10.64.43.166","49.44.80.47","TCP","60","64435  >  443 [ACK] Seq=1 Ack=38593 Win=43952 Len=0"
"318","0.012000","116.50.76.245","49.44.80.47","TCP","60","64435  >  443 [ACK] Seq=1 Ack=38593 Win=43952 Len=0"
"319","0.012000","49.44.80.47","116.50.76.245","TCP","590","443  >  64435 [ACK] Seq=46633 Ack=1 Win=49312 Len=536 [TCP segment of a reassembled PDU]"
"320","0.012000","49.44.80.47","10.64.43.166","TCP","590","443  >  64435 [ACK] Seq=46633 Ack=1 Win=49312 Len=536 [TCP segment of a reassembled PDU]"
"321","0.012000","10.64.43.166","49.44.80.47","TCP","60","64435  >  443 [ACK] Seq=1 Ack=39129 Win=43416 Len=0"
"322","0.012000","116.50.76.245","49.44.80.47","TCP","60","64435  >  443 [ACK] Seq=1 Ack=39129 Win=43416 Len=0"
"323","0.012000","49.44.80.47","116.50.76.245","TCP","590","443  >  64435 [ACK] Seq=47169 Ack=1 Win=49312 Len=536 [TCP segment of a reassembled PDU]"
"324","0.012000","49.44.80.47","10.64.43.166","TCP","590","443  >  64435 [ACK] Seq=47169 Ack=1 Win=49312 Len=536 [TCP segment of a reassembled PDU]"
"325","0.012000","49.44.80.47","116.50.76.245","SSLv2","590","Encrypted Data [TCP segment of a reassembled PDU]"
"326","0.012000","49.44.80.47","10.64.43.166","SSLv2","590","Encrypted Data [TCP segment of a reassembled PDU]"
"327","0.012000","49.44.80.47","116.50.76.245","TCP","590","[TCP segment of a reassembled PDU]"
"328","0.012000","49.44.80.47","10.64.43.166","TCP","590","[TCP segment of a reassembled PDU]"
"329","0.012000","49.44.80.47","116.50.76.245","TCP","590","[TCP segment of a reassembled PDU]"
"330","0.012000","49.44.80.47","10.64.43.166","TCP","590","[TCP segment of a reassembled PDU]"
"331","0.012000","49.44.80.47","116.50.76.245","TCP","590","[TCP segment of a reassembled PDU]"
"332","0.012000","49.44.80.47","10.64.43.166","TCP","590","[TCP segment of a reassembled PDU]"
"333","0.012000","10.64.43.166","49.44.80.47","TCP","60","[TCP Window Update] 64435  >  443 [ACK] Seq=1 Ack=39129 Win=65392 Len=0"
"334","0.012000","116.50.76.245","49.44.80.47","TCP","60","[TCP Window Update] 64435  >  443 [ACK] Seq=1 Ack=39129 Win=65392 Len=0"
"335","0.012000","49.44.80.47","116.50.76.245","TCP","590","[TCP segment of a reassembled PDU]"
"336","0.012000","49.44.80.47","10.64.43.166","TCP","590","[TCP segment of a reassembled PDU]"
"337","0.012000","49.44.80.47","116.50.76.245","TCP","590","[TCP segment of a reassembled PDU]"
"338","0.012000","49.44.80.47","10.64.43.166","TCP","590","[TCP segment of a reassembled PDU]"
"339","0.012000","49.44.80.47","116.50.76.245","TCP","590","[TCP segment of a reassembled PDU]"
"340","0.012000","49.44.80.47","10.64.43.166","TCP","590","[TCP segment of a reassembled PDU]"
"341","0.012000","49.44.80.47","116.50.76.245","TCP","590","[TCP segment of a reassembled PDU]"
"342","0.012000","49.44.80.47","10.64.43.166","TCP","590","[TCP segment of a reassembled PDU]"
"343","0.012000","49.44.80.47","116.50.76.245","TCP","590","[TCP segment of a reassembled PDU]"
"344","0.012000","49.44.80.47","10.64.43.166","TCP","590","[TCP segment of a reassembled PDU]"
"345","0.012000","49.44.80.47","116.50.76.245","TCP","590","[TCP segment of a reassembled PDU]"
"346","0.012000","49.44.80.47","10.64.43.166","TCP","590","[TCP segment of a reassembled PDU]"
"347","0.012000","49.44.80.47","116.50.76.245","TCP","590","[TCP segment of a reassembled PDU]"
"348","0.012000","49.44.80.47","10.64.43.166","TCP","590","[TCP segment of a reassembled PDU]"
"349","0.012000","49.44.80.47","116.50.76.245","TCP","590","[TCP segment of a reassembled PDU]"
"350","0.012000","49.44.80.47","10.64.43.166","TCP","590","[TCP segment of a reassembled PDU]"
"351","0.012000","49.44.80.47","116.50.76.245","TCP","590","[TCP segment of a reassembled PDU]"
"352","0.012000","49.44.80.47","10.64.43.166","TCP","590","[TCP segment of a reassembled PDU]"
"353","0.012000","49.44.80.47","116.50.76.245","TCP","590","[TCP segment of a reassembled PDU]"
"354","0.012000","49.44.80.47","10.64.43.166","TCP","590","[TCP segment of a reassembled PDU]"
"355","0.012000","49.44.80.47","116.50.76.245","TCP","590","[TCP segment of a reassembled PDU]"
"356","0.012000","49.44.80.47","10.64.43.166","TCP","590","[TCP segment of a reassembled PDU]"
"357","0.012000","49.44.80.47","116.50.76.245","TCP","590","[TCP segment of a reassembled PDU]"
